{
  "schema_version": "specialist_profile.v1",
  "room": "closet",
  "aliases": [
    "closet"
  ],
  "role": "reuse",
  "reuse_of": "bedroom",
  "scope": "Closet: reaproveita a marcenaria do quarto (guarda-roupa); portas de correr nao tem builder. Sem brain proprio.",
  "owner": "tools.rooms.closet",
  "state": "NO_INDEPENDENT_BRAIN_USE_BEDROOM_JOINERY",
  "knowledge_room_ids": [
    "closet"
  ],
  "source_ids": [
    "cross.room.material-and-instance-rules",
    "room.closet.wardrobe-sliding-doors"
  ],
  "recipe_ids": [
    "cabinet.drawer-box-and-hardware",
    "cabinet.reusable-components"
  ],
  "capability_ids": [],
  "tool_allowlist": [],
  "constraints": [
    "Nao criar, mover ou apagar parede, porta ou janela.",
    "Medida sem ancora no PDF/consensus nao e inventada: pedir ou recusar.",
    "Tecnica sem capacidade registrada responde BLOCKED_CAPABILITY_MISSING; nao gerar Ruby ad hoc."
  ],
  "result_types": [
    "advisory_plan",
    "blocked"
  ],
  "stop_conditions": [
    "Capacidade ausente ou PLANNED para a tecnica pedida.",
    "Medida, unidade ou origem ausente no pedido.",
    "O pedido exige ferramenta fora da allowlist deste perfil.",
    "O pedido altera arquitetura derivada do PDF.",
    "Mudanca de aparencia: encaminhar para VISUAL_REVIEW do Felipe (nunca aprovar sozinho)."
  ],
  "execution_authorized": false
}
